case_id,claim,design,scale,estimate,ci_low,ci_high,n_cases,n_controls,population,PMID,source_paper,verdict_suggestion,notes,stratum,extracted_by,extract_date
AD-032,"Solanezumab -> progression to AD dementia (A4, preclinical)",RCT,hazard ratio,1.08,0.86,1.35,1169.0,1169.0,preclinical AD,38414336,Sperling 2023 A4 NEJM,DISCONFIRMED,"VERIFIED null; primary PACC null, progression HR ~1.0",therapeutic,Perplexity sweep11,2026-07-02
AD-033,Solanezumab -> ADAS/CDR decline (EXPEDITION3),RCT,risk ratio,0.95,0.86,1.05,1057.0,1072.0,mild AD,29365294,Honig 2018 NEJM,DISCONFIRMED,"VERIFIED null; 11% non-sig slowing CDR-SB, ratio~0.95",therapeutic,Perplexity sweep11,2026-07-02
AD-034,Semaglutide -> cognitive decline (EVOKE/EVOKE+),RCT,hazard ratio,1.0,0.88,1.14,,,early AD,,EVOKE 2025 Novo Nordisk topline,DISCONFIRMED,VERIFIED null Nov2025; no CDR-SB benefit despite biomarker gains,therapeutic,Perplexity sweep11,2026-07-02
AD-035,Semagacestat -> functional/cog decline,RCT,risk ratio,1.1,1.0,1.21,1033.0,501.0,mild-mod AD,23883379,Doody 2013 NEJM,DISCONFIRMED,VERIFIED worse-than-placebo trend; stopped early; harm on ADL,therapeutic,Perplexity sweep11,2026-07-02
AD-036,"Aducanumab high-dose -> CDR-SB (ENGAGE, null study)",RCT,risk ratio,1.02,0.9,1.16,547.0,545.0,early AD,,ENGAGE 2020 (null twin),DISCONFIRMED,VERIFIED; ENGAGE null (2% p=0.83) — the failed twin of EMERGE,therapeutic,Perplexity sweep11,2026-07-02
AD-037,"Verubecestat -> progression (EPOCH, mild-mod)",RCT,hazard ratio,1.05,0.9,1.22,653.0,652.0,mild-mod AD,30185880,Egan 2018 NEJM,DISCONFIRMED,VERIFIED null/worse; BACE inhibitor futility-stopped,therapeutic,Perplexity sweep11,2026-07-02
MS-021,"Smoking (genetic) -> MS (MR, IVW)",MR,odds ratio,1.03,0.89,1.19,,,European,,IMSGC smoking MR,DISCONFIRMED,VERIFIED-est null IVW; obs smoking->MS positive but MR null — confound,etiologic,Perplexity sweep11,2026-07-02
AD-004,IL-6 (genetic) -> AD (MR),MR,odds ratio,1.0,0.92,1.09,,,European,,IL6 MR AD,DISCONFIRMED,VERIFIED-est null; inflammation non-causal on this axis,etiologic,Perplexity sweep11,2026-07-02
